{
  "schema_version": "edge_finder.app.v1",
  "kind": "sports_registry",
  "sport": "ALL",
  "run_id": "run_registry0000000000000",
  "generated_at": "2026-10-02T00:00:00Z",
  "sports": {
    "MLB": {"repo": "chmoses98/edge-finder-api", "branch": "main", "app_root": "app/latest",
            "raw_base_url": "https://raw.githubusercontent.com/chmoses98/edge-finder-api/main/app/latest",
            "status": "ACTIVE", "notes": ["production data and the app export both live on main"]},
    "CFB": {"repo": "chmoses98/cfb-edge-finder", "branch": "main", "app_root": "app/latest",
            "raw_base_url": "https://raw.githubusercontent.com/chmoses98/cfb-edge-finder/main/app/latest",
            "status": "ACTIVE", "notes": ["model retired: market inventory + accounting only; model_prices.json is empty by design"]},
    "NFL": {"repo": "chmoses98/nfl-edge-finder", "branch": "handicap-reports", "app_root": "app/latest",
            "raw_base_url": "https://raw.githubusercontent.com/chmoses98/nfl-edge-finder/handicap-reports/app/latest",
            "status": "ACTIVE", "notes": ["published with the handicap report; the branch is replaced wholesale on every publish"]},
    "NBA": {"repo": "chmoses98/nba-edge-finder", "branch": "data-archive", "app_root": "app/latest",
            "raw_base_url": "https://raw.githubusercontent.com/chmoses98/nba-edge-finder/data-archive/app/latest",
            "status": "ACTIVE", "notes": ["written by the capture worker into the archive root"]},
    "NHL": {"repo": "chmoses98/NHL-edge-finder", "branch": "data-archive", "app_root": "app/latest",
            "raw_base_url": "https://raw.githubusercontent.com/chmoses98/NHL-edge-finder/data-archive/app/latest",
            "status": "ACTIVE", "notes": ["written by the capture worker into the archive root"]},
    "SOCCER": {"repo": "chmoses98/soccer-edge-finder", "branch": "data-archive", "app_root": "app/latest",
               "raw_base_url": "https://raw.githubusercontent.com/chmoses98/soccer-edge-finder/data-archive/app/latest",
               "status": "ACTIVE", "notes": ["written by archive_publish.sh from the merged latest slate"]},
    "TENNIS": {"repo": "chmoses98/Tennis-Edge-Finder", "branch": "tennis-data", "app_root": "tennis-edge-finder/data/app/latest",
               "raw_base_url": "https://raw.githubusercontent.com/chmoses98/Tennis-Edge-Finder/tennis-data/tennis-edge-finder/data/app/latest",
               "status": "ACTIVE", "notes": ["the tennis-data branch keeps everything under the tennis-edge-finder/data prefix"]},
    "CBB": {"repo": "chmoses98/cbb-edge-finder", "branch": "app-data", "app_root": "app/latest",
            "raw_base_url": "https://raw.githubusercontent.com/chmoses98/cbb-edge-finder/app-data/app/latest",
            "status": "ACTIVE", "notes": ["NCAA Division I men's basketball: a prospectively frozen research system (incumbent pure-0.2.0, shadow challengers, the P-ROSTER-1 roster overlay)",
                                          "no recommendations and no wagers; bet_authority RESEARCH_ONLY",
                                          "the app publication is derived from the immutable pre-tip projection archive, roster truth and the prospective scoreboard by cbb_edge/app/sift_app; it never re-runs a model",
                                          "the app-data branch is replaced wholesale on every publish (the archives stay on their append-only branches)"]}
  },
  "router": {"repo": "chmoses98/kalshi-bet-router", "branch": "app-data", "app_root": "app/latest",
             "raw_base_url": "https://raw.githubusercontent.com/chmoses98/kalshi-bet-router/app-data/app/latest",
             "status": "ACTIVE", "notes": ["router_health.json and recent_deliveries.json: counts only, never a wager"]}
}
